{
  "standard": "URF-SG",
  "version": "v1.0",
  "cert_id": "URF-SG-NUM-4-0p5",
  "admissible_class": "finite_numeric",
  "statement": {
    "type": "spectral_gap",
    "quantity": "lambda_1(P | ker(P)^\u22a5)",
    "lower_bound": 0.5
  },
  "instance": {
    "geometry": {
      "name": "FiniteDimToy",
      "model": "R^4"
    },
    "hilbert_space": {
      "H": "R^4"
    },
    "operator": {
      "name": "P",
      "definition": "Diagonal numeric toy operator",
      "domain": "R^4"
    },
    "projection": {
      "name": "Per",
      "subspace": "span{e0}",
      "kernel_orthogonal": "span{e1,...,e3}"
    }
  },
  "P": [
    [
      0.0,
      0.0,
      0.0,
      0.0
    ],
    [
      0.0,
      0.5,
      0.0,
      0.0
    ],
    [
      0.0,
      0.0,
      0.5,
      0.0
    ],
    [
      0.0,
      0.0,
      0.0,
      0.5
    ]
  ],
  "n": 4,
  "created_utc": "2026-01-27T02:07:18.664472Z",
  "notes": "Generated diagonal toy certificate: eigenvalues [0,gap,...,gap].",
  "checks": {
    "method": "numeric",
    "notes": "Verifier computes smallest nonzero eigenvalue and checks >= lower_bound."
  }
}